<?xml version="1.0" encoding="UTF-8"?>
<aut:automator
	xmlns:aut="http://dsg.ce.unipr.it/software/deus/schema/automator"
	xmlns:xsi="http://www.w3.org/2001/XMLSchema-instance"
	xsi:schemaLocation="http://dsg.ce.unipr.it/software/deus/schema/automator automator.xsd ">


	<!-- *** EVENTS *** -->

	<aut:event id="birth" handler="it.unipr.ce.dsg.deus.impl.event.BirthEvent"
	 schedulerListener="it.unipr.ce.dsg.deus.example.basic.BirthSchedulerListener"><!-- when scheduled, creates a new node -->
		<aut:params>
			<aut:param name="hasSameAssociatedNode" value="false" />
		</aut:params>
		<aut:events><!-- events to be scheduled on created node -->
		    <aut:reference id="connection" />
		</aut:events>
	</aut:event>

	<aut:event id="connection" handler="it.unipr.ce.dsg.deus.p2p.event.SingleConnectionEvent" schedulerListener="it.unipr.ce.dsg.deus.example.basic.SingleConnectionSchedulerListener" oneShot="true" >
		<aut:params>
			<aut:param name="isBidirectional" value="true" />
			<aut:param name="hasSameAssociatedNode" value="false" />
		</aut:params>
		<aut:events>
			<aut:reference id="disconnection" />
		</aut:events>
	</aut:event>

	<aut:event id="disconnection" handler="it.unipr.ce.dsg.deus.p2p.event.DisconnectionEvent" schedulerListener="it.unipr.ce.dsg.deus.example.basic.DisconnectionSchedulerListener" oneShot="true">
		<aut:params>
			<aut:param name="hasSameAssociatedNode" value="false" />
		</aut:params>
		<aut:events>
			<aut:reference id="death" />
		</aut:events>
	</aut:event>

	<aut:event id="death" handler="it.unipr.ce.dsg.deus.impl.event.DeathEvent" oneShot="true">
		<aut:params>
			<aut:param name="hasSameAssociatedNode" value="false" />
		</aut:params>
	</aut:event>	

	<aut:event id="logPopulationSize" handler="it.unipr.ce.dsg.deus.impl.event.LogPopulationSizeEvent" />

	<aut:event id="logNodeDegree" handler="it.unipr.ce.dsg.deus.p2p.event.LogNodeDegreeEvent" />


	<!-- *** NODE SPECIES *** -->

	<aut:node id="supernode" handler="it.unipr.ce.dsg.deus.p2p.node.Peer" />

	<!-- *** PROCESSES *** -->

	<!-- with 1/lambda = 50 and 1/lambda' = 20000, we have E[N] = 400 -->

	<aut:process id="periodic1" handler="it.unipr.ce.dsg.deus.impl.process.PeriodicProcess">
		<aut:params>
			<aut:param name="period" value="50" />
		</aut:params>
		<aut:nodes>
			<aut:reference id="supernode" />
		</aut:nodes>
		<aut:events>
			<aut:reference id="birth" />
		</aut:events>
	</aut:process>
	
	<aut:process id="periodic2" handler="it.unipr.ce.dsg.deus.impl.process.PeriodicProcess">
		<aut:params>
			<aut:param name="period" value="0" />
		</aut:params>
		<aut:nodes>
			<aut:reference id="supernode" />
		</aut:nodes>
		<aut:events>
			<aut:reference id="connection" />
		</aut:events>
	</aut:process>
	
	<aut:process id="poisson3" handler="it.unipr.ce.dsg.deus.impl.process.PoissonProcess">
		<aut:params>
			<aut:param name="meanArrival" value="5" />
		</aut:params>
		<aut:nodes>
			<aut:reference id="supernode" />
		</aut:nodes>
		<aut:events>
			<aut:reference id="death" />
		</aut:events>
	</aut:process>

	<aut:process id="poisson4" handler="it.unipr.ce.dsg.deus.impl.process.PoissonProcess">
		<aut:params>
			<aut:param name="meanArrival" value="20000" />
		</aut:params>
		<aut:nodes>
			<aut:reference id="supernode" />
		</aut:nodes>
		<aut:events>
			<aut:reference id="disconnection" />
		</aut:events>
	</aut:process>
	
	<aut:process id="periodic3" handler="it.unipr.ce.dsg.deus.impl.process.PeriodicProcess">
		<aut:params>
			<aut:param name="period" value="10000" />
		</aut:params>
		<aut:events>
		    <aut:reference id="logPopulationSize" />
			<!-- aut:reference id="logNodeDegree" / -->
		</aut:events>
	</aut:process>

	<!-- *** SIMULATION *** -->

	<aut:engine maxvt="100000" seed="123456789">
		<aut:logger level="ALL"/>
		<aut:processes>
			<aut:reference id="periodic1" />
			<aut:reference id="periodic3" />
		</aut:processes>
	</aut:engine>

</aut:automator>
